{
  "$schema": "../../../schema/passport-overlay-v1.schema.json",
  "component": "Checkbox",
  "purpose": "A single native checkbox, and CheckboxGroup for several that share a name, with mixed state, a select-all and group-level validation.",
  "intentDomains": [
    "ActionIntent"
  ],
  "$operationsNote": "Mirrors shared/core/agent/field.ts, which is what the runtime dispatches on. source/components/shared/core/agent/__tests__/field-passport.test.ts fails if the two drift. No `apiMethod`: a field is written through its ref — the element for most of these, a handle for Combobox and DatePicker — and that is a normal case, not a gap.",
  "operations": {
    "setValue": {
      "summary": "Write a value into the field, as though a person had entered it.",
      "effects": [
        "replaces the field's current value",
        "fires the host's change handler"
      ],
      "reversible": true
    },
    "clear": {
      "summary": "Empty the field.",
      "effects": [
        "discards the field's current value",
        "fires the host's change handler"
      ],
      "reversible": true
    },
    "focus": {
      "summary": "Move keyboard focus to the field.",
      "effects": [
        "moves focus"
      ],
      "reversible": false
    }
  },
  "accessibility": {
    "supplied": [
      "native <input type=checkbox> semantics, including Space to toggle",
      "the indeterminate state is set as a DOM property, which is the only way it exists",
      "CheckboxGroup renders a fieldset with the group label as its legend",
      "description and error linked by aria-describedby"
    ],
    "required": [
      "a `label` on every checkbox — an unlabelled one is unusable by anything but sight",
      "`name` when the value is submitted with a form"
    ]
  },
  "composition": {
    "allowedChildren": [
      "Checkbox"
    ],
    "mustNotContain": [
      "label"
    ],
    "notes": "CheckboxGroup expects Checkbox children or an `options` array, not both. The component supplies its own label element."
  },
  "safeMutations": {
    "allowed": [
      "size",
      "orientation",
      "description",
      "selectAll"
    ],
    "forbidden": [
      "checked",
      "defaultChecked",
      "value",
      "defaultValue",
      "name",
      "options",
      "required",
      "disabled",
      "readOnly",
      "onChange",
      "onCheckedChange",
      "onValueChange",
      "error"
    ],
    "rationale": "Layout is safe. The checked state is the user's answer and `options` is the question; an agent that edits either is answering on their behalf."
  },
  "propNotes": {
    "options": "The declarative form of the group's children. Supply this or Checkbox children, never both."
  }
}
