{
  "$schema": "../../../schema/passport-overlay-v1.schema.json",
  "component": "Switch",
  "purpose": "A setting that takes effect as it is flipped, on a native checkbox with role=switch, with an optimistic pending state while the change is saved.",
  "intentDomains": [
    "ActionIntent"
  ],
  "$operationsNote": "Mirrors shared/core/agent/field.ts, which is what the runtime dispatches on. source/components/shared/core/agent/__tests__/field-passport.test.ts fails if the two drift. No `apiMethod`: a field is written through its ref — the element for most of these, a handle for Combobox and DatePicker — and that is a normal case, not a gap. Inside an <AgentSurface> the component registers itself with these operations; NumberInput and RadioGroup are then written through their own commit path rather than the element.",
  "operations": {
    "setValue": {
      "summary": "Write a value into the field, as though a person had entered it.",
      "effects": [
        "replaces the field's current value",
        "fires the host's change handler"
      ],
      "reversible": true
    },
    "focus": {
      "summary": "Move keyboard focus to the field.",
      "effects": [
        "moves focus"
      ],
      "reversible": false
    }
  },
  "accessibility": {
    "supplied": [
      "role=switch on a native checkbox, with aria-checked tracking the state",
      "Space toggles",
      "the loading state is announced rather than silently blocking the control"
    ],
    "required": [
      "a `label` saying what the setting is, phrased so that on and off are both obvious",
      "do not use it where the change needs a Save button — that is a Checkbox"
    ]
  },
  "composition": {
    "mustNotContain": [
      "label"
    ],
    "notes": "Renders its own label element."
  },
  "safeMutations": {
    "allowed": [
      "size",
      "labelPosition",
      "description"
    ],
    "forbidden": [
      "checked",
      "defaultChecked",
      "value",
      "name",
      "required",
      "disabled",
      "readOnly",
      "loading",
      "onChange",
      "onCheckedChange",
      "error"
    ],
    "rationale": "A Switch applies its change immediately, so writing `checked` is performing the setting, not describing it. `loading` is owned by the component's own async handling."
  },
  "propNotes": {
    "loading": "Managed when the change handler returns a promise. Setting it by hand opts out of that."
  }
}
