{
  "$schema": "../../../schema/passport-overlay-v1.schema.json",
  "component": "RadioGroup",
  "purpose": "One choice out of a few, on native radios: a single tab stop, arrow keys between the choices, and a card variant for richer options.",
  "intentDomains": [
    "ActionIntent"
  ],
  "$operationsNote": "Mirrors shared/core/agent/field.ts, which is what the runtime dispatches on. source/components/shared/core/agent/__tests__/field-passport.test.ts fails if the two drift. No `apiMethod`: a field is written through its ref — the element for most of these, a handle for Combobox and DatePicker — and that is a normal case, not a gap. Inside an <AgentSurface> the component registers itself with these operations; NumberInput and RadioGroup are then written through their own commit path rather than the element.",
  "operations": {
    "setValue": {
      "summary": "Write a value into the field, as though a person had entered it.",
      "effects": [
        "replaces the field's current value",
        "fires the host's change handler"
      ],
      "reversible": true
    },
    "clear": {
      "summary": "Empty the field.",
      "effects": [
        "discards the field's current value",
        "fires the host's change handler"
      ],
      "reversible": true
    },
    "focus": {
      "summary": "Move keyboard focus to the field.",
      "effects": [
        "moves focus"
      ],
      "reversible": false
    }
  },
  "accessibility": {
    "supplied": [
      "native radio semantics: one tab stop for the group, arrow keys to move and select",
      "a fieldset with the group label as its legend",
      "description and error linked by aria-describedby"
    ],
    "required": [
      "a `label` for the group — a set of radios with no question is meaningless",
      "`name`, so the browser treats them as one group"
    ]
  },
  "composition": {
    "allowedChildren": [
      "Radio",
      "RadioCard"
    ],
    "notes": "Children or `options`, not both. A radio outside a RadioGroup loses the arrow-key behaviour."
  },
  "safeMutations": {
    "allowed": [
      "size",
      "orientation",
      "variant",
      "description"
    ],
    "forbidden": [
      "value",
      "defaultValue",
      "name",
      "options",
      "required",
      "disabled",
      "readOnly",
      "onChange",
      "onValueChange",
      "error"
    ],
    "rationale": "The selected value is the user's answer and `options` is the question."
  },
  "propNotes": {
    "variant": "`card` renders each option as a selectable surface; the semantics are identical."
  }
}
