{
  "$schema": "../../../schema/passport-overlay-v1.schema.json",
  "component": "NumberInput",
  "purpose": "A numeric field that reads and writes numbers the way the locale does, with a stepper, clamping and currency formatting.",
  "intentDomains": [
    "ActionIntent"
  ],
  "$operationsNote": "Mirrors shared/core/agent/field.ts, which is what the runtime dispatches on. source/components/shared/core/agent/__tests__/field-passport.test.ts fails if the two drift. No `apiMethod`: a field is written through its ref — the element for most of these, a handle for Combobox and DatePicker — and that is a normal case, not a gap.",
  "operations": {
    "setValue": {
      "summary": "Write a value into the field, as though a person had entered it.",
      "effects": [
        "replaces the field's current value",
        "fires the host's change handler"
      ],
      "reversible": true
    },
    "clear": {
      "summary": "Empty the field.",
      "effects": [
        "discards the field's current value",
        "fires the host's change handler"
      ],
      "reversible": true
    },
    "focus": {
      "summary": "Move keyboard focus to the field.",
      "effects": [
        "moves focus"
      ],
      "reversible": false
    }
  },
  "accessibility": {
    "supplied": [
      "role=spinbutton semantics with aria-valuenow, aria-valuemin and aria-valuemax",
      "ArrowUp and ArrowDown step; PageUp and PageDown use `largeStep`",
      "the stepper buttons are aria-hidden, because the keyboard already does what they do",
      "description and error linked by aria-describedby"
    ],
    "required": [
      "a `label`, or `aria-label` when the field is visually unlabelled",
      "`min` and `max` where a range exists, so assistive technology can announce it"
    ]
  },
  "composition": {
    "mustNotContain": [
      "label",
      "input"
    ],
    "notes": "Renders its own label and input."
  },
  "safeMutations": {
    "allowed": [
      "size",
      "placeholder",
      "description",
      "stepper",
      "leading",
      "trailing",
      "selectOnFocus",
      "useGrouping",
      "clearable"
    ],
    "forbidden": [
      "value",
      "defaultValue",
      "name",
      "min",
      "max",
      "step",
      "largeStep",
      "decimals",
      "currency",
      "locale",
      "clampBehavior",
      "snapToStep",
      "required",
      "disabled",
      "readOnly",
      "onValueChange",
      "error"
    ],
    "rationale": "Everything that defines the number — its bounds, its precision, its currency, how it snaps — is domain truth, not styling. Changing `decimals` or `currency` silently reinterprets a stored value."
  },
  "propNotes": {
    "clampBehavior": "Decides whether an out-of-range entry is corrected as it is typed or left for validation. Changing it changes what the user is allowed to leave in the field.",
    "wheel": "Scroll-to-change is off by default because it fires while a page is being scrolled past."
  }
}
